{
  "$schema": "http://dotnet.github.io/docfx/schemas/v1.0/schema.json#",
  "version": "1.0.0",
  "id": "https://github.com/dotnet/docfx/test/schemas/contextobject.test.schema.json",
  "title": "ContextObject",
  "description": "The test schema for context object",
  "type": "object",
  "properties": {
    "breadcrumb_path": {
      "type": "string",
      "contentType": "href"
    },
    "toc_rel": {
      "type": "string",
      "contentType": "href"
    }
  }
}